{
  "$defs": {
    "actor": {
      "additionalProperties": false,
      "properties": {
        "actorId": {
          "minLength": 1,
          "type": "string"
        },
        "actorType": {
          "enum": [
            "human",
            "agent",
            "kernel"
          ]
        }
      },
      "required": [
        "actorType",
        "actorId"
      ],
      "type": "object"
    },
    "exclusionRef": {
      "additionalProperties": false,
      "properties": {
        "$exclusion": {
          "$ref": "#/$defs/id"
        }
      },
      "required": [
        "$exclusion"
      ],
      "type": "object"
    },
    "gapRef": {
      "additionalProperties": false,
      "properties": {
        "$gap": {
          "$ref": "#/$defs/id"
        }
      },
      "required": [
        "$gap"
      ],
      "type": "object"
    },
    "id": {
      "pattern": "^[a-z0-9][a-z0-9._:-]*$",
      "type": "string"
    },
    "provenance": {
      "additionalProperties": false,
      "properties": {
        "extractedAt": {
          "type": "string"
        },
        "extractor": {
          "type": "string"
        },
        "locator": {
          "type": "string"
        },
        "sourceArtifact": {
          "type": "string"
        }
      },
      "required": [
        "sourceArtifact",
        "locator",
        "extractor",
        "extractedAt"
      ],
      "type": "object"
    },
    "timestamp": {
      "pattern": "^\\d{4}-\\d{2}-\\d{2}(T\\d{2}:\\d{2}:\\d{2}(\\.\\d+)?Z)?$",
      "type": "string"
    }
  },
  "$id": "https://docket.offgriddevices.com/schema/ReadinessReport.schema.json",
  "$schema": "https://json-schema.org/draft/2020-12/schema",
  "additionalProperties": false,
  "description": "",
  "properties": {
    "biasChecksStatus": {
      "items": {
        "additionalProperties": true,
        "type": "object"
      },
      "type": "array"
    },
    "blockers": {
      "items": {
        "additionalProperties": true,
        "type": "object"
      },
      "type": "array"
    },
    "computedBiasRisks": {
      "items": {
        "$ref": "#/$defs/id"
      },
      "type": "array"
    },
    "confidence": {
      "enum": [
        "explicit",
        "inferred",
        "absent"
      ]
    },
    "createdAt": {
      "$ref": "#/$defs/timestamp"
    },
    "createdBy": {
      "$ref": "#/$defs/actor"
    },
    "episode": {
      "$ref": "#/$defs/id"
    },
    "flipSummary": {
      "additionalProperties": true,
      "type": "object"
    },
    "id": {
      "$ref": "#/$defs/id"
    },
    "ingestionProvenance": {
      "$ref": "#/$defs/provenance"
    },
    "kernelVersion": {
      "type": "string"
    },
    "mandateScorecard": {
      "$ref": "#/$defs/id"
    },
    "openExclusions": {
      "items": {
        "$ref": "#/$defs/id"
      },
      "type": "array"
    },
    "openGaps": {
      "items": {
        "$ref": "#/$defs/id"
      },
      "type": "array"
    },
    "policyVersion": {
      "type": "string"
    },
    "ready": {
      "type": "boolean"
    },
    "rev": {
      "minimum": 1,
      "type": "integer"
    },
    "seed": {
      "type": "integer"
    },
    "standardsAssessment": {
      "$ref": "#/$defs/id"
    },
    "supersedes": {
      "$ref": "#/$defs/id"
    },
    "type": {
      "const": "ReadinessReport"
    },
    "warnings": {
      "items": {
        "additionalProperties": true,
        "type": "object"
      },
      "type": "array"
    }
  },
  "required": [
    "id",
    "type",
    "rev",
    "createdBy",
    "createdAt",
    "episode",
    "standardsAssessment",
    "mandateScorecard",
    "blockers",
    "warnings",
    "openGaps",
    "openExclusions",
    "flipSummary",
    "biasChecksStatus",
    "computedBiasRisks",
    "ready",
    "policyVersion",
    "kernelVersion",
    "seed"
  ],
  "title": "ReadinessReport",
  "type": "object"
}
